{
  "title": "Wandel im Verborgenen",
  "subtitle": "Die NZZ hat Ansichtskarten von anno dazumal denselben Perspektiven von heute gegenübergestellt. Manifest wurden landschaftlicher, klimatischer und wirtschaftlicher Wandel und Merkmale der Politik.",
  "images": [
    {
      "url": "https://img.nzz.ch/s=w540,pd1/o=75/http://nzz-img.s3.amazonaws.com/2017/8/10/98ee4bb0-f8a1-40be-94f4-5a448fe63082.jpeg",
      "label": "1965",
      "caption": "Ansichtskarte, versendet 1965: Der Verkehr auf dem Zürcher Bahnhofplatz wird von Hand geregelt.",
      "credit": "(Bild: Simon Tanner / NZZ)"
    },
    {
      "url": "https://img.nzz.ch/s=w540,pd1/o=75/http://nzz-img.s3.amazonaws.com/2017/8/10/e9930834-1b84-4186-80c4-23ba7512519a.jpeg",
      "label": "1985",
      "caption": "Das heutige Bild ist ähnlich. Grundlegend verändert hat sich der HB aber unter der Erde.",
      "credit": "(Bild: Simon Tanner / NZZ)"
    },
    {
      "url": "https://img.nzz.ch/s=w540,pd1/o=75/http://nzz-img.s3.amazonaws.com/2017/8/10/98ee4bb0-f8a1-40be-94f4-5a448fe63082.jpeg",
      "label": "1995",
      "caption": "Ansichtskarte, versendet 1965: Der Verkehr auf dem Zürcher Bahnhofplatz wird von Hand geregelt.",
      "credit": "(Bild: Simon Tanner / NZZ)"
    },
    {
      "url": "https://img.nzz.ch/s=w540,pd1/o=75/http://nzz-img.s3.amazonaws.com/2017/8/10/e9930834-1b84-4186-80c4-23ba7512519a.jpeg",
      "label": "2005",
      "caption": "Das heutige Bild ist ähnlich. Grundlegend verändert hat sich der HB aber unter der Erde.",
      "credit": "(Bild: Simon Tanner / NZZ)"
    },
    {
      "url": "https://img.nzz.ch/s=w540,pd1/o=75/http://nzz-img.s3.amazonaws.com/2017/8/10/98ee4bb0-f8a1-40be-94f4-5a448fe63082.jpeg",
      "label": "2017",
      "caption": "Ansichtskarte, versendet 1965: Der Verkehr auf dem Zürcher Bahnhofplatz wird von Hand geregelt.",
      "credit": "(Bild: Simon Tanner / NZZ)"
    }
  ],
  "sources": [
    {
      "text": "Zürcher Verkehrsverbund",
      "link": {
        "url": "https://www.zvv.ch/",
        "isValid": true
      }
    }
  ],
  "notes": "Anmerkung"
}
